{
  "type": "knowledge.observatory.published.v1",
  "source": "semantAH",
  "timestamp": "2025-12-25T06:05:00Z",
  "payload": {
    "url": "https://github.com/heimgewebe/semantAH/releases/latest/download/knowledge.observatory.json",
    "generated_at": "2025-12-25T06:00:00Z",
    "ts": "2025-12-25T05:55:00Z",
    "sha": "e3b0c44298fc1c149afbf4c8996fb92427ae41e4649b934ca495991b7852b855",
    "schema_ref": "https://schemas.heimgewebe.org/contracts/knowledge.observatory.schema.json"
  }
}
